{
  "$schema": "http://json-schema.org/draft-07/schema#",
  "type": "object",
  "required": ["Monday", "Tuesday", "Wednesday", "Thursday", "Friday"],
  "properties": {
    "Monday": { "$ref": "#/definitions/daySchedule" },
    "Tuesday": { "$ref": "#/definitions/daySchedule" },
    "Wednesday": { "$ref": "#/definitions/daySchedule" },
    "Thursday": { "$ref": "#/definitions/daySchedule" },
    "Friday": { "$ref": "#/definitions/daySchedule" }
  },
  "definitions": {
    "daySchedule": {
      "type": "array",
      "items": {
        "type": "object",
        "required": ["title", "type", "time", "occurrences"],
        "properties": {
          "title": { "type": "string" },
          "type": { "type": "string" },
          "time": {
            "type": "object",
            "required": ["start", "end"],
            "properties": {
              "start": {
                "type": "string",
                "pattern": "^[0-2][0-9]:[0-5][0-9]$"
              },
              "end": { "type": "string", "pattern": "^[0-2][0-9]:[0-5][0-9]$" }
            }
          },
          "occurrences": {
            "type": "string"
          }
        }
      }
    }
  }
}
