{
  "Monday": [],
  "Tuesday": [
    {
      "title": "Programowanie sieciowe",
      "type": "lecture",
      "time": {
        "start": "11:15",
        "end": "12:45"
      },
      "occurrences": "nparz"
    },
    {
      "title": "Projektowanie obiektowe - wzorce projektowe",
      "type": "lecture",
      "time": {
        "start": "11:15",
        "end": "12:45"
      },
      "occurrences": "parz"
    },
    {
      "title": "Zarządzanie projektami",
      "type": "lecture",
      "time": {
        "start": "13:15",
        "end": "14:45"
      },
      "occurrences": "1-15"
    }
  ],
  "Wednesday": [
    {
      "title": "Zarządzanie projektami",
      "type": "lab",
      "time": {
        "start": "08:30",
        "end": "09:45"
      },
      "occurrences": "parz"
    },
    {
      "title": "Podstawy konteneryzacji i architektury mikroserwisów",
      "type": "lecture",
      "time": {
        "start": "10:15",
        "end": "11:45"
      },
      "occurrences": "1-3,5-8"
    },
    {
      "title": "Podstawy konteneryzacji i architektury mikroserwisów",
      "type": "lab",
      "time": {
        "start": "12:15",
        "end": "13:45"
      },
      "occurrences": "nparz"
    },
    {
      "title": "Programowanie sieciowe",
      "type": "lab",
      "time": {
        "start": "12:15",
        "end": "13:45"
      },
      "occurrences": "parz"
    }
  ],
  "Thursday": [
    {
      "title": "Projektowanie dynamicznych stron WWW",
      "type": "lab",
      "time": {
        "start": "09:15",
        "end": "10:45"
      },
      "occurrences": "nparz"
    },
    {
      "title": "Projektowanie obiektowe - wzorce projektowe",
      "type": "lab",
      "time": {
        "start": "12:15",
        "end": "13:45"
      },
      "occurrences": "nparz"
    },
    {
      "title": "Programowanie gier 2D",
      "type": "lab",
      "time": {
        "start": "14:15",
        "end": "15:45"
      },
      "occurrences": "1-15"
    },
    {
      "title": "Programowanie gier 2D",
      "type": "lecture",
      "time": {
        "start": "18:15",
        "end": "19:45"
      },
      "occurrences": "1-15"
    }
  ],
  "Friday": []
}
